{
  "schema_id": "ghostrace.parquet-archive-profile",
  "schema_version": 1,
  "format": "parquet",
  "compatibility": "strict",
  "source_schema_id": "ghostrace.event-envelope",
  "source_schema_version": 1,
  "columns": [
    {"name":"event_id","physical_type":"utf8","nullable":false,"source":"event.event_id","semantic":"identity","conversion":"identity"},
    {"name":"ingest_seq","physical_type":"uint64","nullable":false,"source":"record.ingest_seq","semantic":"total_order","conversion":"identity"},
    {"name":"schema_version","physical_type":"uint32","nullable":false,"source":"event.schema_version","semantic":"schema_identity","conversion":"identity"},
    {"name":"observed_at","physical_type":"timestamp_nanos_utc","nullable":false,"source":"event.observed_at","semantic":"source_time","conversion":"rfc3339_to_timestamp_nanos"},
    {"name":"ingested_at","physical_type":"timestamp_nanos_utc","nullable":false,"source":"event.ingested_at","semantic":"receipt_time","conversion":"rfc3339_to_timestamp_nanos"},
    {"name":"source","physical_type":"utf8","nullable":false,"source":"event.source","semantic":"source","conversion":"identity"},
    {"name":"kind","physical_type":"utf8","nullable":false,"source":"event.kind","semantic":"event_kind","conversion":"identity"},
    {"name":"collector_instance","physical_type":"utf8","nullable":true,"source":"event.collector_instance","semantic":"collector_identity","conversion":"identity"},
    {"name":"source_cursor","physical_type":"utf8","nullable":true,"source":"event.source_cursor","semantic":"source_cursor","conversion":"identity"},
    {"name":"provenance_version","physical_type":"utf8","nullable":false,"source":"event.provenance_version","semantic":"provenance","conversion":"identity"},
    {"name":"policy_profile_id","physical_type":"utf8","nullable":false,"source":"event.policy_profile_id","semantic":"policy_identity","conversion":"identity"},
    {"name":"policy_profile_version","physical_type":"uint32","nullable":false,"source":"event.policy_profile_version","semantic":"policy_version","conversion":"identity"},
    {"name":"evidence","physical_type":"utf8","nullable":false,"source":"event.evidence","semantic":"evidence_level","conversion":"identity"},
    {"name":"parent_event_id","physical_type":"utf8","nullable":true,"source":"event.parent_event_id","semantic":"causal_parent","conversion":"identity"},
    {"name":"payload_json","physical_type":"utf8","nullable":false,"source":"event.payload","semantic":"canonical_payload","conversion":"canonical_json"},
    {"name":"gap_source","physical_type":"utf8","nullable":true,"source":"event.payload.source","semantic":"gap_source","conversion":"identity"},
    {"name":"gap_reason_code","physical_type":"utf8","nullable":true,"source":"event.payload.reason_code","semantic":"gap_reason","conversion":"identity"},
    {"name":"gap_dropped_count","physical_type":"uint64","nullable":true,"source":"event.payload.dropped_count","semantic":"gap_count","conversion":"identity"},
    {"name":"gap_from_cursor","physical_type":"utf8","nullable":true,"source":"event.payload.from_cursor","semantic":"gap_boundary","conversion":"identity"},
    {"name":"gap_to_cursor","physical_type":"utf8","nullable":true,"source":"event.payload.to_cursor","semantic":"gap_boundary","conversion":"identity"},
    {"name":"gap_volume_digest","physical_type":"utf8","nullable":true,"source":"event.payload.volume_digest","semantic":"gap_scope","conversion":"identity"},
    {"name":"gap_root_ids_json","physical_type":"utf8","nullable":true,"source":"event.payload.root_ids","semantic":"gap_scope","conversion":"canonical_json"},
    {"name":"gap_remediation_json","physical_type":"utf8","nullable":true,"source":"event.payload.remediation","semantic":"gap_recovery","conversion":"canonical_json"}
  ],
  "ordering": {"fields":["observed_at","ingest_seq","event_id"],"tie_break":"ingest_seq_then_event_id"},
  "gap_mapping": {"event_kind":"gap","columns":["gap_source","gap_reason_code","gap_dropped_count","gap_from_cursor","gap_to_cursor","gap_volume_digest","gap_root_ids_json","gap_remediation_json"],"missing_behavior":"null_for_non_gap_events","omission":"reject"},
  "provenance_mapping": {"source_column":"provenance_version","semantics":"exact_adapter_version","unknown_behavior":"reject"},
  "policy_mapping": {"id_column":"policy_profile_id","version_column":"policy_profile_version","semantics":"exact_policy_identity","unknown_behavior":"reject"},
  "evolution": {"rule":"additive_nullable_only","additions":"new_profile_version_required","removals":"new_profile_version_required","type_changes":"new_profile_version_required","unknown_columns":"reject"},
  "storage": {"compression":"zstd","dictionary_encoding":"disabled","statistics":"disabled","page_index":"disabled","encryption":"not_assumed","plaintext_boundary":"explicit_derived_archive","temporary_file_mode":"0600","atomic_publish":"required","cleanup_on_failure":"required","source_untouched":"required","automatic_creation":"forbidden","deletion_scope":"external_copy_limits_explicit"},
  "bounds": {"max_columns":23,"max_row_bytes":1048576,"max_rows":10000000,"max_metadata_bytes":65536}
}
